{
  "meta": {
    "artifact_name": "claim_trace_matrix",
    "validation_extension": "Validation Extension C",
    "artifact_version": "0.1.0",
    "brief_id": "brief_demo_action_camera_001",
    "producer": "Deterministic Claim Trace Matrix Builder",
    "status": "needs_review",
    "workflow_version": "V2",
    "product_name": "运动相机",
    "generation_method": "deterministic_script_no_model_call",
    "notes": [
      "source_found only means the source field exists in a project artifact; it does not prove real-world truth.",
      "Downstream Agent artifacts are treated as references or governance decisions, not original fact proof."
    ]
  },
  "source_priority": {
    "factual_sources": [
      "original brief",
      "formal proof materials when provided"
    ],
    "governance_decision_sources": [
      "Human Approval",
      "Brand Compliance"
    ],
    "downstream_artifact_rule": "Downstream Agent artifacts can cite or transform claims but cannot prove original facts.",
    "mock_data_rule": "Mock or demo data cannot prove real business outcomes."
  },
  "claims": [
    {
      "claim_id": "claim_product_capability_001",
      "claim_category": "product_capability",
      "claim_summary": "Brief describes high-definition motion video and 360 recording support for the demo product.",
      "source_artifact": "data/sample_brief.json",
      "source_json_pointer": "/core_features/0/proof",
      "evidence_artifact": "data/sample_brief.json",
      "evidence_json_pointer": "/core_features/0/proof",
      "evidence_status": "requires_human_verification",
      "downstream_artifacts": [
        {
          "artifact": "outputs/selling_point_matrix.json",
          "json_pointer": "/data/feature_benefit_mapping/0/risk_boundary",
          "reference_type": "risk_inheritance",
          "value_consistency": "consistent",
          "notes": "Downstream keeps proof requirements and avoids absolute superiority."
        },
        {
          "artifact": "outputs/brand_compliance_report.json",
          "json_pointer": "/data/risk_items/0/blocking_rule",
          "reference_type": "governance_decision",
          "value_consistency": "consistent",
          "notes": "Final copy and image prompts remain blocked until footage and specs are available."
        }
      ],
      "risk_level": "major",
      "human_review_required": true,
      "compliance_decision": "blocked_for_final_generation",
      "release_gate_effect": {
        "structured_planning_package": "approved",
        "growth_evaluation": "approved_for_evaluation_only",
        "final_marketing_copy": "blocked",
        "final_image_prompt": "blocked",
        "image_generation": "blocked",
        "frontend_page": "blocked",
        "public_release": "blocked"
      },
      "required_action": "Collect high-resolution footage, specifications, and review boundaries before final generation.",
      "source_exists": "source_found"
    },
    {
      "claim_id": "claim_product_capability_002",
      "claim_category": "product_capability",
      "claim_summary": "Brief describes post-capture reframing and multiple export ratios as product capabilities.",
      "source_artifact": "data/sample_brief.json",
      "source_json_pointer": "/core_features/1/proof",
      "evidence_artifact": "data/sample_brief.json",
      "evidence_json_pointer": "/specs/export_formats",
      "evidence_status": "requires_human_verification",
      "downstream_artifacts": [
        {
          "artifact": "outputs/selling_point_matrix.json",
          "json_pointer": "/data/core_selling_point_priority/0/proof_status",
          "reference_type": "risk_inheritance",
          "value_consistency": "consistent",
          "notes": "Downstream marks the capability as needing product demo proof."
        },
        {
          "artifact": "outputs/creative_copy_pack_outline.json",
          "json_pointer": "/data/creative_copy_pack_outline/2/selling_point_boundaries/1",
          "reference_type": "risk_inheritance",
          "value_consistency": "consistent",
          "notes": "Copy outline keeps proof and confirmation boundaries."
        }
      ],
      "risk_level": "medium",
      "human_review_required": true,
      "compliance_decision": "needs_revision",
      "release_gate_effect": {
        "structured_planning_package": "approved",
        "growth_evaluation": "approved_for_evaluation_only",
        "final_marketing_copy": "blocked",
        "final_image_prompt": "blocked",
        "image_generation": "blocked",
        "frontend_page": "blocked",
        "public_release": "blocked"
      },
      "required_action": "Provide product demo evidence for reframing and export workflow before public-facing use.",
      "source_exists": "source_found"
    },
    {
      "claim_id": "claim_product_capability_003",
      "claim_category": "product_capability",
      "claim_summary": "Brief describes motion stabilization for sports use cases.",
      "source_artifact": "data/sample_brief.json",
      "source_json_pointer": "/core_features/2/proof",
      "evidence_artifact": "data/sample_brief.json",
      "evidence_json_pointer": "/specs/stabilization",
      "evidence_status": "requires_human_verification",
      "downstream_artifacts": [
        {
          "artifact": "outputs/selling_point_matrix.json",
          "json_pointer": "/data/feature_benefit_mapping/2/proof_required/2",
          "reference_type": "risk_inheritance",
          "value_consistency": "consistent",
          "notes": "Downstream requires test conditions."
        },
        {
          "artifact": "outputs/human_approval_record.json",
          "json_pointer": "/approval_items/2/decision",
          "reference_type": "governance_decision",
          "value_consistency": "consistent",
          "notes": "Human approval keeps technical/performance claims blocked."
        }
      ],
      "risk_level": "critical",
      "human_review_required": true,
      "compliance_decision": "blocked_for_final_generation",
      "release_gate_effect": {
        "structured_planning_package": "approved",
        "growth_evaluation": "approved_for_evaluation_only",
        "final_marketing_copy": "blocked",
        "final_image_prompt": "blocked",
        "image_generation": "blocked",
        "frontend_page": "blocked",
        "public_release": "blocked"
      },
      "required_action": "Provide stabilization test conditions and limits; do not imply unconditional stability.",
      "source_exists": "source_found"
    },
    {
      "claim_id": "claim_product_capability_004",
      "claim_category": "product_capability",
      "claim_summary": "Brief describes waterproof and durability-related outdoor coverage.",
      "source_artifact": "data/sample_brief.json",
      "source_json_pointer": "/core_features/3/proof",
      "evidence_artifact": "data/sample_brief.json",
      "evidence_json_pointer": "/specs/waterproof",
      "evidence_status": "requires_human_verification",
      "downstream_artifacts": [
        {
          "artifact": "outputs/selling_point_matrix.json",
          "json_pointer": "/data/feature_benefit_mapping/3/proof_required/0",
          "reference_type": "risk_inheritance",
          "value_consistency": "consistent",
          "notes": "Downstream requires rating or test standard."
        },
        {
          "artifact": "outputs/brand_compliance_report.json",
          "json_pointer": "/data/risk_items/1/blocking_rule",
          "reference_type": "governance_decision",
          "value_consistency": "consistent",
          "notes": "Compliance blocks final generation until conditions are confirmed."
        }
      ],
      "risk_level": "critical",
      "human_review_required": true,
      "compliance_decision": "blocked_for_final_generation",
      "release_gate_effect": {
        "structured_planning_package": "approved",
        "growth_evaluation": "approved_for_evaluation_only",
        "final_marketing_copy": "blocked",
        "final_image_prompt": "blocked",
        "image_generation": "blocked",
        "frontend_page": "blocked",
        "public_release": "blocked"
      },
      "required_action": "Provide waterproof rating, depth, duration, usage limits, and durability conditions.",
      "source_exists": "source_found"
    },
    {
      "claim_id": "claim_ai_capability_001",
      "claim_category": "ai_capability",
      "claim_summary": "Brief describes AI-assisted automatic editing that identifies moments and creates a short-video draft.",
      "source_artifact": "data/sample_brief.json",
      "source_json_pointer": "/core_features/4/proof",
      "evidence_artifact": "data/sample_brief.json",
      "evidence_json_pointer": "/core_features/4/proof",
      "evidence_status": "requires_human_verification",
      "downstream_artifacts": [
        {
          "artifact": "outputs/selling_point_matrix.json",
          "json_pointer": "/data/feature_benefit_mapping/4/risk_boundary",
          "reference_type": "risk_inheritance",
          "value_consistency": "consistent",
          "notes": "Downstream limits the claim to assistance and efficiency."
        },
        {
          "artifact": "outputs/brand_compliance_report.json",
          "json_pointer": "/data/risk_items/2/blocking_rule",
          "reference_type": "governance_decision",
          "value_consistency": "consistent",
          "notes": "Compliance prevents outcome guarantees."
        }
      ],
      "risk_level": "major",
      "human_review_required": true,
      "compliance_decision": "needs_revision",
      "release_gate_effect": {
        "structured_planning_package": "approved",
        "growth_evaluation": "approved_for_evaluation_only",
        "final_marketing_copy": "blocked",
        "final_image_prompt": "blocked",
        "image_generation": "blocked",
        "frontend_page": "blocked",
        "public_release": "blocked"
      },